created,title_clean,body_clean
2025-05-13 20:39:06,I bought an entire skin bundle but they are not available for me,Hi so as the title say I bought this entire bundle for something around 1223 coins I got some of the sprays and name cards through lootboxes before so thats why it was cheaper BUT after buying it I cannot equip the skins at all The only skin functioning was Soldiers skin Which I love by the way But Kirikos and Hanzos skins cannot be equiped at all
2025-05-13 17:25:40,Collab Skins,So with the announcement of the Street Fighter Collab I made a tier list to see how many collab skins each hero got since the launch of Overwatch 2 The First Slide is without the Le SSerafim recolours and the second with them
2025-05-13 15:49:55,Is 6v6 open queue more competitive than 5v5,Hi gamers In Overwatch 2 recent past open queue was never considered a highly competitive game mode Even though there was a dedicated player base playing competitive open queue 5v5 was still the real Overwatch Now that we have 6v6 open queue with limits rules and bans Im proposing a discussion about the status of open queue in relation to its competitiveness Whats your opinion 5v5 is still the real Overwatch 6v6 has taken the throne Or this whole discussion is pointless Lets discuss
2025-05-13 11:15:53,Opinions on widowmaker,inb4 git gut Hey guys ive played overwatch since release of ow1 always been a huge widowmaker fan shes one of my main characters that i play and i do think i am pretty decent at playing her Ive also been playing ow2 since release but i had a longer break lately and came back to check out stadium and got into the game again but when i play widow in normal or even ranked matches i always feel like she lacks something Like she isnt as strong as she used to be Am i tripping or was she nerfed heavily Also her perks dont feel as good compared to other characters of similar playstyle I almost feel stupid picking widow when i feel like ashe cassidy freja or at this point any other character has a much bigger impact on the game It might just be me maybe im underperforming after a longer break but i just feel like shes a bit offmeta i guess Let me know your thoughts
2025-05-13 09:32:10,OCE server issues recently,Im sorry if this isnt the forum to post this but I wasnt able to find a fix to this problem online anywhere else I want to preface this by saying I think the overwatch team have been doing a great job recently with stadium and making the game feel great to play again Now for the issue I play on OCE servers and average about 50ping and I would occasionally 110 games be put into a lobby or server where I average 120ping which wouldnt be too large an issue as it happened so rarely Now however this server routing has been putting me in these 120ping servers 23 games and into servers where I sit at 400ping For a competitive game it makes it really difficult for me to play well enjoy the game and help my teammates Does anyone know how to fix this or why this happens Once again sorry for writing a negative post and if this isnt the place to type it
2025-05-13 08:44:21,Competitive Crashes,Anyone familiar with this This started happening today The only changes that occurred is I upgraded my Nvidia graphics card to version 57640 May 12 2025 release and then the issues started today I got my first ever competitive strike 15mins for this This appears to affect Stadium Mode and Training area I was able to run 2 quickplay games without issue I am running a 4090 and can play all other games on HighUltra without issues I never had any Overwatch issues before
2025-05-12 23:15:08,My Issues with Ow2 Stadium,This Script is being written on 592025 This will eventually Be outdated So I have been playing a LOT of overwatch stadium Its fun for the most part The Most Part Alright Ill cut the short act Overwatch stadium is far from perfect like eons from perfect this is Every single issue I have with stadium 1 Mercy Jesus Christ this creature in this game is the most unfair character as unfair characters get I would rather fight soldier before tactical visor buffs if it meant that mercy either got removed from the roster or just nerfed heavily One of her upgrades makes her staff able to heal from an extra 33 farther distance Do you understand what all of this means If you have a slight understanding of good mercy mobility YOU ARE ESSENTIALLY UNKILLABLE Before all you redditors go in the comments and go eguh bro never played before I have at least 100 hours in this game The worst part is that the roster is so small noone can perfectly counter mercy Widowmaker would be great for this but guess what shes not in the roster 2 Weapon Power Boosts Attack Speed Boosts Annoying but fine Cooldown Reducers Rare But my lord do Power and attack boosts need either a higher price increase or a Cap Only way to exceed the cap is to use the special ability modifiers Otherwise you cant exceed the cap Sure some characters could use damage boosts but maybe Cassidy Reinhardt and Soldier 76 can have a slight nerf in dmg boosts I was playing genji and there was a cassidy who just got one headshot and one shot me he had 40 dmg boost A FORTY PERCENT DAMAGE BOOST 3 Anyone who plays Orisa Dva Kiriko Mercy Moria Cassidy and mei Exclusively for their stupid amounts of op powerups Go touch Grass 4 Ana This is a generally personal issue with Ana in general but I will continue I am under the personal idea that you shouldnt have an ability that makes one aspect of the game unable to work for 12 seconds Anas nade is already annoying What makes it worse is when she sleeps you first I believe that she should have a heal reducing nade not a heal canceling nade You have the code for it to work Just fix it 5 Moria I think by this consensus If a character has a high healing output give them either low health with few ways to make it back or give them low dps Moria ignores BOTH of these That paired with the noskill auto aim being a part of her main weapon and her biotic orbs make these annoying already That paired with the fact that she gets a get out of jail free card with no way of figuring out where she went besides an audio cue which lets face it you wont hear while a whole war is being fought6 Genji Genji is very very bad in stadium Even though I still play him I will admit he is terrible His dragonblade is almost never able to be used even then it can barely 2 hit Supports and his abilities suck to use when your just starting out Sure I can Play a different game or hero But why dont you guys get off of fortnight and reddit when you lose a game and then go on a rant about how the weapon is completely broken I know that is Ironic coming from this video but I feel like I am making a pretty good point 7 Upgrades Sure stadium is fun but I want more experimentation sure the whole thing is more arcade like game But the whole power system is a little eh Im not trying to dunk on the programmers because I know that it takes time to write game code I want more powers that change your abilities make genjis dash make him turn around and slash again but make it deal 50 less damage Make morias fade able to blind someone for a quick second make mercy unplayable Make dva pilotable while self destruct is online for a little bit longer at the cost of her life 6 Genji Genji is very very bad in stadium Even though I still play him I will admit he is terrible His dragonblade is almost never able to be used even then it can barely 2 hit Supports and his abilities suck to use when your just starting out Sure I can Play a different game or hero But why dont you guys get off of fortnight and reddit when you lose a game and then go on a rant about how the weapon is completely broken I know that is Ironic coming from this video but I feel like I am making a pretty good point 7 Upgrades Sure stadium is fun but I want more experimentation sure the whole thing is more arcade like game But the whole power system is a little eh Im not trying to dunk on the programmers because I know that it takes time to write game code I want more powers that change your abilities make genjis dash make him turn around and slash again but make it deal 50 less damage Make morias fade able to blind someone for a quick second make mercy unplayable Make dva pilotable while self destruct is online for a little bit longer at the cost of her life The Point is overwatch 2 is not perfect and frankly it will never be Blizzard will constantly try to fix the issue but make 50 more I believe that CircletoonsHD said it best Blizzard created a game so bad that the community got hyped saying overwatch was back when loot boxes were implemented So what should blizzard do I dont know Im a thirteen year old who is weirdly obsessed with fancy lighters
2025-05-12 18:30:27,Can we have a civil discussion,Hey everyone Ive been a long time OW player playing the game since its initial release back in 2016 It was the first FPS team shooter Ive ever played and I thought it was a cool new and exciting change Met a lot of people and made a lot of friends because of it Years of playing and getting better with time there was an announcement that overwatch 2 was going to happen I was excited about it because I felt OW was a pretty solid game I was wrong They things that they promised like having a story mode you can play with your friends never happened as far as I am concerned On top of that the Ow I have grown to love was gone A game I paid money for was erased and I was forced into a game that I didnt even get to try out beforehand I was robbed in a financial since never again able to play a game that I paid for Then theres just being robbed of fun I played the game it wasnt too bad the initial drop date My friends and I grumbled about it but we trucked along Changes to heros I could live with like Orisa and her Javalin with the loss of a shield barrier Even Doom becoming DPS But more changes came and I was getting more irritated The biggest change was the player base All of the OG players started dropping off because they hated the changes and I couldnt blame them In came a new player base Many of them I met were one trick ponies and played the game like it was COD The game felt like it was ushering in a new team dynamic which was actually not being a team Supporting a play style that encouraged many players to be solo in a five no longer 6 until recent updates player team Now there are bans because its too hard and annoying to combat characters like symetra and Sombra Isnt the whole point of comp and team based games is to work together to beat other players and the opposing team I feel like this game is dead and no longer fun Maybe a lot of youd dont feel the way I feel but I would love to hear your opinions regardless As the title reads keep it civil
2025-05-12 15:03:23,Super Street Fighter X Overwatch 2,Sharing these additional concepts to add to the previous one Doomfist Akuma Zarya Marissa Juno Sakura Venture THawk
2025-05-12 14:39:21,From a Casual Overwatch player since 2017,I started playing when i was a student in 2017 Climbed from Bronze to Diamond on support Im just so glad i never left even during the last 2 years of Overwatch 1 content drought No game ever hit all the buttons as well as Overwatch did and now does so well There are so many things to learn and experience in the game mechanical skill situational awareness meta strategies counter swapadapting to enemy or team sense of community etc I watched OWL and now OWCS and elite Overwatch is just beautiful to watch The game has been so good recently especially with perks stadium and regular patches Ive been having so much fun The only regret i have is that I work full time now and barely have time to play To the devs thank you for not giving up on Overwatch I love that its free to play and not pay to win If the skins make money and help keep the game going Im all for it For now im quite happy with the Battle Pass and havent spent money on collabs yet but maybe if a LOTR collab drops i wont be able to resist
2025-05-12 08:52:10,i miss old overwatchthe community,for context i used to play overwatch with my friends every single day in middle school now im a sophomore in college and i dont even have a pc at my apartment recently ive just been missing gaming so much especially old overwatch i never really played again when overwatch 2 came out just a couple times here and there to check out the new stuff but i never quite got back into it im not sure if i miss the game or just the community i had a friend group of like 45 other people and we would play together afterschool everyday and now life just feels so dull and im really consumed by like school and work im really really hoping to get back into gaming in the future but i cant afforddont have room for a pc right now and im saving up for other essentials i guess this is just kind of a vent post but im wondering if anyones been in the same boat or just any thoughts are welcome 3 thanks for readingg
2025-05-12 05:45:31,Am I Going Crazy Overwatch 2Street Fighter 6,One of my favorite games is Overwatch 2 however I also love fighting games like Street Fighter I started up Street Fighter 6 for the first time in a while when I heard a familiar humming noise in the beginning of Not on the Sidelines Street Fighter 6 Main Theme It turns out that humming noise is the same that plays when you boot up Overwatch 2 NOTE I couldnt find footage of booting up Overwatch so I had to go on GeForce Now and record the footage on my phone It doesnt take long to load on PC so you might have to turn your volume up Its more noticable on consoles which usually have a longer loading time Not on the Sidelines the SF6 Song
2025-05-12 03:02:54,Can someone check this and see if I have permanent Headhunter perk active,Story I think I discovered a bug that caused Ana to permanently have the Headhunter perknot just for a single match but across every game I played Even after a restart of the game Unfortunately I have no idea what triggered it I didnt do anything out of the ordinaryjust played as usual Changing perks didnt seem to make a difference Headhunter remained active even right at the start of each round By the end of the matches it felt like I had three perks active at once This was in competitive 6v6 mode Now the icon is not there but it FEELS like Im doing too much damage I made a bug report here I dont knowam I just imagining things Im not really winning more and Im not sure my stats are actually better Maybe just a bit better than usual But I do feel Im winning duels that I shouldnt Replay 21YRC3 and CF1WK6
2025-05-12 01:33:47,Competitive is annoying,This has probably been said so much here but i wanna get it off my chest now competitive should have a minimum level or endorsement lvl or a barrier to entry there has been to many games today where endorsement level 1 and 2 either smurfing or being new players has ruined games overwatch should be like valorant in which you have to be lvl 20 to play ranked why cant overwatch have a barrier to entry for competitive so peoples game arent ruined love yall
2025-05-11 23:31:07,Definitely off topic but,Thought of a hypothetical fight between Overwatch and TF2 Full post is here Overwatch vs Team Fortress 2 Who Would Win
2025-05-11 22:12:14,My friend was surprised that I dont have 100 hours on any hero,I started playing back in 2017 but I only started playing Overwatch 2 last August Is there anyone with a similar distribution of hours
2025-05-11 20:01:03,Am I missing something,Downloaded overwatch again after a break and it appears i have 2 lootboxes avaliable to me but when i go to the page i dont have anything to open
2025-05-11 19:32:02,I love stadium,I have played Overwatch since 2017 Havent stopped until 2021 GM on ps45 and played from time to time in 20242025 I rarely played any video game in that period But man since I tried out stadium havent had this much fun since my first year on overwatch Havent played genji in such a long time and he feels balanced for the first time in ages I really hope they only add new heroes gradually cause genji wont be playable I use overwatch 2 as a projection the more theyre added I hope Im wrong I thank the devs for their big efforts
2025-05-11 18:52:26,Is overwatch 2 toxic,After not playing ow2 for about a month I decided to play it for a little bit After playing a few games I got absolutely roasted possibly cyber bullied I only just play the game for fun and Im a decent player at best I dont play completive mode at all After dealing with this today Im not sure if I want to continue to play ow2 after this experience I dont know if anyone has gone through this before but I thought I shared this
2025-05-11 18:43:30,I love Overwatch 2 but it seems like its detrimental to my mental health,TLDR Overwatch 2 is my favorite game I dont want to play anything else but at the same time it makes me feel depressed Do I just stop playing my favorite game Sorry but I have nowhere else to post this and no one to talk it with I feel miserable I hate that I love this game but people only use chats to flame When I turn it off they find some way to piss me off Even when Im winning I still feel annoyed for some unknown reason I hate that Sombra exists I hate the unbalancing I hate that even after taking a very long break I manage to experience this emotion that Ive never felt anywhere else before and my chest feeling hot due to anger Seriously I wish it was different I really love this game I even got addicted at some point There have been a lot of times that it gets to my head and I want to just take it out on someone but maybe thats just online gaming for you but OW2 is just different somehow I just love this game I dont want to play anything else not MR not TF2 and definitely not Paladins I even learned Blender to create fanart The picture is from an obscure animation that I made How do I cope with this Do I just stop playing my favorite game
2025-05-11 18:14:36,Is there a way to download of overwatch on my ps5,I bought a ps5 and I wanted to download overwatch but the only thing that shows up is overwatch 2 I really dont want to have to use my computer because it runs at one frame per someday
2025-05-11 04:16:40,Why did 6v6 become unplayable,6v6 is what made me come back to Overwatch It was fun last season and amazing at the start of this one But lately the mode has become hell Before youd usually have a 222 comp on your team but now the enemy team always gets it while your team ends up with 4 DPS Not to mention those players who select support to fill then immediately switch to Ashe when they die If you want to play DPS just pick your character from the start Dont make us lose the first fight for free The difference in team coordination is also insane When I get a kill from an offangle and try to return to my team the enemy Zarya will chase me to spawn and no one on my team will even try to help But when someone flanks and attacks me no one on my team turns around The ping button is literally useless its like my teammates are deaf Oh man and those fucking Dva players they will chase you to your backline and your support wont heal you even if you spam I need healing the moment you see her diving you
2025-05-11 04:09:11,Dmc X Overwatch crossover Ideas,I figured Dante as genji and Vergil as hanzo 2 brothers who fought but made up Nero as doom solely because I play doom and his arm just fits the gauntlet cavaliere as pharah I feel like it fits the silhouette very nicely Lady as zarya the huge gun seemed like a no brainer to me Nico as either sym or illari neither get many skins and I figured why not Kyrie as mercy because its overwatch and I could think of 1 for kiri or Juno Did I miss any obvious ones let me know
2025-05-11 00:58:49,Super Capcom x Overwatch 2,Celebrating again the reveal of the street fighter x Overwatch with some of the concepts Ive created in the past some old some new some modified Cant wait to see what they come up with
2025-05-11 00:17:46,Overwatch 2 Hero UI Concept Made By Kevin Gerstner,Heroes are core to the Overwatch experience What if the UIUX helped further connect the player to the heroes they love This Season 17 concept gives the game and Heroes an overhauled experience Learn more about the concept
2025-05-11 00:05:02,Some topics to discuss,1 Why doesnt Orisa have her spear in her back 2 Why doesnt JQ have her axe in her back 3 In general Why arent secondary weapons shown in 3D models 4 Why dont heroes interact with each others in Stadiums lobbies 5 Why doesnt perk selection have voice acting 6 Why cant we have an option to select OW1 music and portraits 7 Why dont supports have a low health indicator in the side of the screen to show low HP allies behind the player point of view 8 Why cant we change mythic skin aspects in hero selection
2025-05-10 22:48:05,Issue with not receiving Ultimate BP bundle rewards,Today I purchased the Ultimate BP bundle using the ingame shop and did not receive any of the rewards from it I didnt get the battle pass 2000 OW coins either of the skins or even the 20 tier skips My Playstation shows the purchase history and my Paypal received the charge but none of the rewards have been granted Ive closed and relaunched OW several times and nothing Do I have to go through Blizzard support or is it just a server issue and I just need to wait a couple hours
2025-05-10 20:04:36,Does anyone actually like overwatch 2 over overwatch 1,I personally hate overwatch 2 compared to the overwatch 1 and my all my friends agree with me However Id like to hear other peoples opinions on the sequel I guess thats what it is though really it was just an update
2025-05-10 19:27:23,Is it worth going back now,I used to play when overwatch 2 came out then quit when they removed Honzo s ability to oneshot then I thought that the game finaly died but today I heard probably late that they added new hero Freja and some kind of perk system so the game clearly hasent died yet and I was thinking of trying again so is it worth trying again as a casual player
