created,title_clean,body_clean
2025-04-26 15:05:25,Stadium Support Tier List,Hey everyone I just reached Elite and my day 1 thoughts are far different to todays Moira and Kiriko seemed unbelievably strong on day one but are now completely useless in my opinion Aside the odd situational double cleanse Juno and Mercy are top tier followed by ana then Lucio in bottom tier Im not going to go into full build lists S Tier Juno Her early game isnt the best she peaks at game 3 Her build is really simple max out ability power and throw in cool down where you can as a second priority and go torpedo spam S Tier Mercy She is strong in every round Go tanky and Rez everyone easily pick up the 15 extra healing when you can Best early perks are convert 100 health to armour and reduce incoming damage by 10 Avoid battle mercy its a trap A tier Ana No scope build is best going full attack damage and taking the larger projectiles perk B tier Moira The only build worth mentioning is ability power ap build shes too squishy for anything else C tier kiriko Damage is the way and double cleanse D tier Lucio D tier go double book and ability power be super squishy hope for the best Lucio is a lot worse in this mode mainly because of third person hes far easier to track Best starting items always go for 25 armour and on mercy take over health at the start
2025-04-26 01:48:13,Stadium starts fun and becomes a doozy of a drain quickly,Dont get me wrong Stadium can be a lot of fun with long lasting final fights I really enjoyed Mei as wrecking ball I had a few of my most intense fights in the stadium these days Nonetheless there are a lot of issues that were raised partially by others as well the matches are way too long 3 rounds out of 5 would be more appropriate team diffs are snowballing because of being able to buy better perks earlier than the other team helping to get more stadium currency even by better performance it should be possible to switch heroes after each round Having a team comp that is countered by the enemy team comp wont be fun for a whole half hour there is seemingly no leaver penalty and there is no reward for the winning team if the whole enemy team forfeits I am having ambiguous feelings about forfeit options Often enough matches can turn around in round 3 at the latest with new perks or people switching up The matchmaking is worse than in QP even It seems that everybody is thrown in at Bronze and has to land on top I had my share of fights fighting against people two ranks higher than me or even top 500 not cool not cool with so many perks it is not balanced at all and probably will never be event loot requires people to queue for all roles or even are an incentive to play every hero with lets say varying success This makes matches even worse Personally I will most likely wait for the first patch to stadium to fix the most urgents nagging points
2025-04-25 20:46:17,I really want to love stadium but,Maaaan is it just not a fun time for me right now Every game there is an unkillable reaper and a aimbotting soldier the games take literal eternity to finish the performance is kinda not great low 80 frames rather than the 150 I usually get and lastlyno xp I know theyve mentioned about tweaking the number but who in their right mind okayed saltine boys aimbot perk How is it literally the first one I loved the first 45 games butyea not really feeling it no more Back to sucking ass in comp I guess sigh How are yall feeling about the mode
2025-04-25 16:29:27,Did they nerf Rein when I wasnt looking Why,So I dont know if Im just an idiot but I just played a game and Reins health was 550 AND one of his perks has been changed I remember playing games a few days ago where his health was 700 and I have clips saved on my console showing me with 700 health when I walk out of the room Am I insane What is happening Also his first perk has been changed No longer does it let the firestrike recharge his shield which can be extremely handy with helping keep you and your team alive and instead it just gives you an extra firestrike if you stun which I think is bull as Reins charge is while fun doesnt do as much damage for how finkiy it is to actually pin someone
2025-04-25 15:09:32,Stadium perk choices,Trying to play as Rein but everyone is avoiding standing near the giant healing shield Should I go full offense and get some lifesteal or continue hoping for teammates who understand why Im blocking
2025-04-25 04:03:40,If your main isnt in Stadium yet,What kind of power upgrades and modifiers do you think theyll have when they make the leap over Im a Lifeweaver main and I reckon hell get the ability to heal more than one target at a time with his primary fire I could see his little heal shots splitting off from the main target and targeting nearby allies for a lower heal value I also see him being able to detonate his platform and deal damage with it I could also see the platform getting a modifier that heals people over time when they stand on it There could also be another that boosts damage I think I think when it comes to Life Grip I reckon theyll give him modifiers that cause gripped allies to leave an explosion where they were to deal damage to enemies in the area I think hell probably also have options to increase healing on his grip as well When it comes to his secondary fire I think theyll probably just port over Superbloom from the perk system as well as giving him the typical lifesteal options For his ult I dont think they would do anything too crazy probably just longer durations more healing waves etc My only interesting idea for it would be if the healing waves also knock back enemies Its fun to think about really so if your main is currently MIA what tools and modifiers do you think theyll get when theyre added
2025-04-24 21:25:16,Colosseum Soldier 76 Health Bug,Found a weird bug with Soldier 76s perks If you end up taking the On Me power and add the Vishkar Condensor andor VitalETee survival perks when your Biotic Field ends you will not just lose the extra 20 max life you got from the power but also the converted health you got from the perks
2025-04-24 20:09:10,Stadium is so fun but how are you guys dealing with Zarya,This isnt a complaint post though personally Im not sure why she was added into this mode as the other 4 tanks can be adjusted to with powersperks As someone who enjoys dva and Orisa I cannot win any game into Zarya Ive tried every different build but I just get melted they even made a perk for both of them to reduce beam damage and that still doesnt work The fact they had to made a specific perk to try deal with Zarya goes to show its such a strong counter to them Anyway has anyone had luck with any specific builds I feel like a helpless player for 20 minutes And before anyone says dont shoot the bubble she has a lot of bubbles in this mode haha
2025-04-24 11:42:17,Stadium is driving me nuts,Okay so first off I just wanna state I love stadium the mode is fantastic and all the new perks and abilities are a blast to mess with HOWEVER the players im getting queued with is abhorrently bad every single match is like pushing a steel ball up a mountain why am I paired with people who cant put together a build to save their life and I have DPS not even using the stuff they built for while the enemy is a stack whos somehow already mastered the system and has perfectly sculpted the exact build necessary to ruin my day I hate how DPS has 90 of the power in their hands so if my dps suck theres genuinely nothing I can do when Ashe is full build 3 tapping me on tank or nearly 1 tapping me on support when I can play mei and build full primary damage and steamrolle a match its beyond dumb the training range exists you can SEE how to put together a build and experiment on how they flow together and what works with what why do I get stuck with ability damage reaper who saves ult for the next millennium while Im getting my skull VIOLATED By an Ashe with a mercy pocket I cant see because shes behind a rein with a damage boosting shield
2025-04-24 11:19:26,New Echo Bastion ult bug discovered,So apparently theres this bug that I just discovered while in the practice range and went to custom game to test if you duplicate a Bastion as Echo and then use your ultimate you can then pick perks for Bastion depending on the perk level you are with Echo Now I dont know when this will be useful as it requires the enemy to have a Bastion and you want to switch the Bastion at least once in that round or game if its control Overall interesting bug funny that Bastion has another ultimate bug though
2025-04-24 09:05:19,Why are we wasting bans on Sombra,Before you say it no I am not a sombra main Im not even a DPS main Without exaggeration in every one of my games so far Gold lobbies sombra is banned But if no one on the team is hard countered by her then why are we immediately banning her This is especially frustrating when were on a map that is particularly strong for a specific hero cough widow cough or comp Take it from a support main whos been through hell and back with sombra she is so easy to deal Although with her new perk change that lets her stay invisible indefinitely I might change my stance on that But my point is all Im asking for is a little thought to why were banning specific heroes Maybe thats too much to ask of Gold players
2025-04-24 07:17:34,They need to remove Orisas Javelin Spin Reduction power from Stadium ASAP It is a literal negative,Idk if any of yall have ever played this power up but holy crap it is without a doubt the worst in the game It makes it to where you literally cannot javelin spin especially if you have the long javelin spin power as well It consumes heat and if you combo this with the other spin perk if you are above 25 heat and you javelin spin you will overheat your weapon Its unreal how bad it is It makes the ability unusable Even if you do not shoot before javelin spinning you cannot chase opponents down because you will overheat after javelin spinning Its comical how this made it out of beta lol
2025-04-24 07:15:36,The Rein did not have a good time,I didnt even know I could reach that amount of ammo on Mei but alas I also had a perk that made me do 40 more damage to barriers a chance to give back ammo Hell of a combo if I say so
2025-04-24 06:55:11,The best Stadium comp right now personal opinion,Junker Queen has pretty crazy survivability and utility Pair shout resetting with shout giving you wound healing and hard stack your ability power youll have 500 overhealth pretty much whenever you want Double carnage and increased carnage lifesteal also just buffs this further No tank comes close to the raw sustain and with how much damage DPS can do thats what matters right now Cass is completely busted once you get to round 3 Hard stack weapon power and damage main powers Fan the hammer roll fan the hammer Insta deletes anyone Much like Cass Soilder gets busted when you hard stack weapon power Couple that with decreased cooldowns and the Visor after Helix power you pretty much become a legal cheater With a Mercy pocket you essentially become the server admin Juno is interchangeable with Kiriko for the 1st support but I think she takes the cake Pulse Torpedoes perks plus stacking ability power allows you to pump CRAZY healing and damage every couple seconds Of course mobility with her hyper ring is always a nice bonus As always Mercy is boosted by the people she can pocket Literally just pocket soilder or cass for a free win if the enemy doesnt have a Mercy With increased survivability and super short res cooldowns youll pretty much always be able to get res off too Shes just really really good at making the busted abilities even more busted I cant believe I am saying this but I go into games HOPING for a Mercy
2025-04-24 05:42:44,Stadium bug,Had this bug pop where all the perks were on one screen so i couldnt scroll and they all were labeled free even though they werent My powers were also moved to the items for some reason
2025-04-24 04:26:17,So soldier 76 in stadium,Absolutely loving stadium so far and I think the grand majority of heros are pretty balanced if you plan perks around the other teams picks but every single game that s76 is on the other team he kills everyone in seconds and if you peak for even a moment to like use torpedoes as juno for example your killed before they even reach him I find him so unfun to go against Has anyone found any reliable perks to not die from him If tried even choosing like entirely survival perks and it doesnt matter how much health I have I die no matter what lol
2025-04-24 03:42:13,Stadium after a day,yesterday i made a post about how i enjoy this game mode i take all of it back the perks are broken u either get rolled or the other team gets rolled immediately it takes forever for the game to finally start my final opinion on this game mode after playing it all night is that it needs a lot of workchange done because i and many many others feel miserable playing it i have to admit lucio kiriko and juno are fun with the right perks other than that id never touch dps or tank on it ive seen a lot of people who say they dislike it and i really want to know why i tried to play it with friends and sadly none of them enjoyed it sucks tbh because i feel like if it was balanced this would be my fav game mode how do u guys feel now after a day about stadium im really curious edit the perks are very confusing too and i feel like they shouldve added less options to pick from
2025-04-23 21:30:11,Is Zaryas Bubble a barrier in Stadium,Does Zaryas bubble count as a barrier for Stadium perks and items like shooting a barrier gives you 10 of the damage dealt back as shields
2025-04-23 20:26:33,Mercy Major Perk Change,Sorry if this was brought up but does anyone know about this change and why it was not included in the patch notes It used to do 150 and cause resurrection have 15 second cool down Now does 50 but triples on critical and does not consume resurrection now
2025-04-23 19:44:25,Did hero bans Kill Comp,So in my opinion I think hero bans has further killed comp The 6v6 return was going in the right direction But hero bans seems like it is doing the opposite of what comp was supposed to do Be competitive It was about how good you knew how to play characters and counter the enemy team If you were that Zen getting picked off by reaper somber switch off zen go and go Kuriko or Moria Maybe have a dps go Cassidy Tired of that pharaoh go hitscan and shield etc It was about how well you can adjust or who you played to get the win Balance heros all day Make new ones Being in 6v6 Add perks But for the love of all things holy dont allow people to remove heroes from a match because they dont want to adjust in order to beat the enemy team Thats a skill issue and thats the point of competitive I can even see adding this feature for lower tiers like gold or below but its no reason why someone cant counter a character in a diamond lobby I was literally support in a lobby where the stacked enemy team banned all the hard counters to hog and watched my team get walked I was on a team that did something similar to dog walk the other team And this is supposed to be balanced They have quick play and arcade but comp What are we doing What are your thoughts about it Edit I play all of the heros except doom hammy zen hanzo wid So yeah not really an issue with adjusting on my end
2025-04-23 18:23:12,Experiencing Bugs with Mythic Skins in Practice Range and also suspended despite never queuing,I spent a long time going through all of the new perks and stadium itemspowers in the practice range When I went to try out Junos mythic in the practice range the mythic highlight intro loaded but I spawned as regular Juno Same thing happened with every other mythic hero skin except for the one I owned Reins I am also suspended from Stadium for 15 hours despite having never queued for it though I have entered the stadium practice range about 4 times and have been disconnected twice due to network issues at my end
2025-04-23 16:03:33,Overwatch Stadium AIMBOTS,Beyond the fact that Soldier 76 gets the perk for the brief visor after a helix I feel like every DPS Im going against Ashe Soldier and Cassidy are insta locking headshots and with the damage increase its almost impossible to play a round without being killed once you show yourself Even backline healing with small characters One thing I have noticed that the people who Im accusing of Aimbotting have relatively fresh accounts with low endorsement ratings Its rough because you need to climb the rating challenge but I feel like its just about every game Im getting insta killed to the point that I cant even leave the spawn area
2025-04-23 14:49:40,Confused about some perks in Stadium being useless,So on Cass for example theres an epic perk called Amaris antidote It gives 25 health and 15 weapon power but the bonus is while healing an ally below 50 health with your Weapon real 15 increased weapon handling But why is that something relevant to Cass who cant heal Similarly Im a bit confused about Zarya perks which give ability power I suppose there are some perks which give grav damage and the one that boosts secondary fire But if you dont have those what does ability power actually do is it just useless Because its defined as increased the damage and healing of your abilities and ultimates that dont rely on your weapons But Zaryas abilities dont do healing or damage unless you use perks I guess
2025-04-23 14:32:40,New DVa perk unlocked,
2025-04-23 10:24:35,Which of roadhogs minor perks do you prefer Hog toss or his new one pent up,Initially I was upset they got rid of hog toss and now I dont know what to feel
2025-04-23 09:31:26,hog new perk bug,if you get 50 extra breathe charge and hold right clickthe last 50 charge dont heal hogis it a bug
2025-04-23 07:25:18,Found a bug on sigmas and zenyattas levitation perks,you can levitate twice just by unpressing the button before the timersound finish
2025-04-23 07:05:12,stadium is actually so not fun and unbalanced,played so many games and it was either roll or berolled no closegames and nocounter play once lost it really seems like some heroes are just outofplace in the game mode and others are built to dominate instead of being able to counter swap or even counterpick perks and abilities it just feels like your fate is sealed within the first round and youre also forced to sit through the hell over and over and over again i can definitely see this not being played after awhile and only appealing to a select minority actually absolute trash
2025-04-23 05:55:36,Initial Stadium thoughts Adds good variety but sometimes misses the mark,Here are my initial thoughts on Stadium after about 5 hours of gameplay Abilities are all super fun but some of them are absolutely horrible to play into Rein Mei Cassidy Soilder the standouts in this regard After a couple of rounds when everyone has crazy HP fights can pretty much become endless until a couple of people hit big ults Massive HP pools and tons of lifesteal and damage reduction makes fights drag on for super long sometimes That baby Dva nano perk especially makes her unbelievable at stalling especially as the increased HP also affects her when shes out of mek Lots of performance issues currently huge resolution and frame rate drops regardless of hardware Hopefully these are fixed ASAP This mode absolutely feels like an entire new game and nothing like OW which is good and bad Its great to have more variety in the game and this will almost certainly help with the feeling of being burnt out by the game For me at least however it definitely wont overtake normal OW as my main mode Itll be a nice side show to go to occasionally nothing more or less For me there should be a little more reward if you lose a game Each game can go beyond half an hour and usually will so losing is especially painful and getting hardly anything only get 1 comp progress to the 100 points adds to the pain Even some pity comp points like 5 per loss would be better This mostly sounds negative but Im still having a ton of fun on Stadium It absolutely has potential and Im hopeful some of the more obvious issues can be fixed soon For now however Stadium is a mixed bag of fun and frustration
2025-04-23 04:44:46,Turns out Reinhardt is Super Broken in Stadium,People are sleeping on Reinhardt right now if you build rein purely for ability damage his firestrikes do absurd amounts of damage With the perk that creates lava from firestrikes it just destroys anyone who is clumped up I cant tell you the amount of times Ive wiped teams by pressing e twice and aiming in the enemys general direction Even when people arent clumped together anyone whos taken even a bit of damage just gets one shot and any tanks who have taken a small beating just melt with a couple fire strikes and a hammer hit take a wild guess which screen shot was me on a different character
2025-04-23 03:59:36,Please just give LW his charge speed back,He feels so clunky to this day and they thought the solution was 10 healing on a perk bro all they have to do is revert the charge up nerf and he suddenly wont feel terrible Hell still suck I mean come on its weaver but at least helol be more fluid to play
2025-04-23 03:50:07,Thoughts of stadium game mode,In my opinion its not all that game changing I mean getting mvp is easy in any role and the perk shop is okay but eh
2025-04-23 03:05:18,Reinhardt bug on new perk,I was testing the new perk Crusaders Fire and the total amount of fire charges is capped at 3 total almost everytime BUT as you see in the video sometimes I could surpass the limit and go up to 10 charges Id like to this be permanent I know they will patch it but let me have dreams and hopes
2025-04-23 02:21:26,SigmaZen Double Hover,With the recent SigmaZen hover perk changes I wanted to check out how it feels to hold XJump Im on PlayStation Come to find out if you hold the jump button to hover release it and press and hold jump again during the duration of the hover you can activate it twice This works for both Sigma and Zen So Hold Jump to activate Hover During Hover release Jump and repeat Step 1 to Double Hover
2025-04-23 01:19:21,New Juno perk is peak,
2025-04-23 00:11:20,Hold Quick Dash to Take Aim can result in using two dash charges with Ready to Hunt Perk,Im not sure if this is a console specific issue but heres whats happening in the video In first example Updraft Use free quick dash Manually enter Take Aim Only the free quick dash charge is used In the second example Updraft Hold quick dash button to enter take aim A free charge additional charge are used
2025-04-23 00:00:38,Stadium performance issues,Totally understand this is a new huge gamemode that will need fine tuning But so far in stadium my frame rate and resolution drop randomly super often Crazy occasional lag spikes and bugs including not having the additional HP from the perks Also 1st person feels JANK for some reason Hopefully this is fixed quickly as I can see the potential of this mode
2025-04-22 23:29:10,Perk idea for Lifeweaver,Imma be honest LW minor perks need to change They arent bad but they can be more interesting After all one cleanses which kinda should be base kit and the other requires you to die which kinda seems antithesis to the game That is why I think that we remove the cleanse effect for pull and make it base kit but in exchange remove its burst heal This is because the first perk I have in mind would be that the pull would now heal the allie for a set minimum and extend it the longer the grap was That could interesting as that would make into a true life line especially for the aggressive teammates The second perk would obviously remove the death perk and instead it would be replaced by a new perk where like Torb the petal platform would now be placed in vertically As such not only can it be an elevator but it may even serve as a self made shield or blockade But for me I would use it as a new sneaky way to push enemies off the maps Thought edit bonus would be to make the grip into an actual catapult but that may be difficult to do
2025-04-22 23:02:30,Stadium is frustrating,I mean not the mode itself but the powers that you have in it When you unlock some perks of certain heroes like DVa which are really mid and then go to the stadium and see some powers that are really funuseful and could be totally taken as perks its frustrating
2025-04-22 22:47:22,Season 16 patch notes,New perks alert
2025-04-22 21:02:20,Rise up Mei mains,We are so back I was wondering why they did not add this when perks were introduced
2025-04-22 20:26:11,The Ice Devil is back,Mei Freeze returns AND she also now has slow with her minor perk Oh we are so banning Mei every game this is about to be hell for anyone with a big hitbox tanks
2025-04-22 15:32:56,Are perks leaving after this season ends,As the title asks are perks only a season 15 thing or will they continue to be in this game I really dont want to lose the perks because theyre really fun
2025-04-22 09:44:12,What do you guys think is the single best perk out of every perk,Personally Void Surge for Ram A burst of pellets randomly Void surge makes ram go from maybe a B tier character imo to an easy S tier because of how easily he is able to absolutely shread both squishies and tanks I dont think ive played with a perk that is more valuable than this one though tracer getting all her blinks back when she uses recall is definitely pretty valuable So what have you found to be the best perk
2025-04-22 08:19:20,Perked Up Event For how long,Im talking about the one that gives you ten crates per week Its called an event or event quest in the menu Does anyone know if that means that it will end at some point and youll no longer be able to get those crates that way
