created,title_clean,body_clean
2025-04-21 22:30:17,Overwatch error bug wont get fixed,Computer new did everything a ticket support instructed me to on Overwatch 2 Updated drivers redownloaded tried to check from network driver update Overwatch 2 is the only game currently that isnt working on my computer Nothing has worked and this bug suddenly appeared while I was in game simply wont go away Ill add that I has a friend try to help me and it didnt work This is a new computer got it a month or two ago
2025-04-21 22:11:47,imagine gauntlet with stadium powers,Stadium really feels like what overwatch 2 was meant to be
2025-04-21 17:38:18,Widowmaker Needs a Rework Not Just a Nerf or Buff,Hey there quick intro about me Im a pretty casual Overwatch player with around 523 hours played since launch I peaked in Diamond as a Widow onetrick but I switch to other heroes now and then especially when I actually want to climb Playing only Widow just isnt viable in Overwatch 2 Widow just isnt a hero you can play decently You either play her perfectly or her impact is basically zero And honestly I hate that Im older now my aim isnt consistent every day but I still pick her because I vibe with her playstyle Add to that the fact that spam is out of control right now Kiriko is spamming shurikens and can twotap you from across the map Tanks just ignore you because they have so much HP and microscopic head hit boxes Widowmaker feels like shes in a terrible spot design wise The game has moved on Its faster more sustainheavy and shes still stuck in Overwatch 1 I get it most of the comments will be fuck Widow and thats fine But I genuinely think she needs a rework I dont care how its done and it shouldnt be on me to figure it out The reality is most of the playerbase hates her as she is now Even when Im having a great game with 80 accuracy and 40 crits I know its not fun to play against We need real suggestions Most Widow posts are either calling for a nerf or a buff depending on who picked her and how well theyre aiming that day A proper rework would make a lot more sense I honestly cant wait for her to be in Stadium I believe she will be the last hero just because how will they balance her
2025-04-21 16:57:25,Just got my first lootbox from dupesrerolls,TLDR its just a normal loot box nothing special I wasnt clear on how receiving the lootbox from duplicate rolls would work and fortunately got to see for myself thanks to leftover credits from overwatch 1 and grinding for all the lootboxes this season I had been getting dupes off commons for a while now and finally hit enough to get my first lootbox off dupes I never saw it communicated that the lootbox rewarded off dupes would guarantee drops that you didnt have yet however after seeing how many dupes it took to exchange for 1 lootbox i had hoped it would be worth it and give rolls that werent dupesguarantee higher rarity drops Unfortunately after opening the lootbox i can confirm it is a regular box I got 1 rare and the rest were common dupes so i essentially burned a shit ton of rolls for one slightly better roll I do understand that the duplicate lootbox fills out faster the higher the reroll rarity however i still think that the current system of addressing rerolls feels extremely lack luster Hopefully devs are still looking at how to best reward the players with lootboxes and make some adjustments to the reroll lootbox so your compensation for hitting a bunch of duplicates isnt more duplicates What i learned Outside of the disappointment i think the biggest thing i learned from this is 1 If you have grey credits save them to buy the hero gallery epicslegendaries since they drop less frequently and on the off chance you get a duplicate it will fill your reroll lootbox more 2 If you collect all of a rarity its better to wait till next season to open more lootboxes New drops of that rarity should enter the pool and you can avoid burning rolls that add up to almost nothing and get you nothing special Edit lootboxes auto open at the end of season so the current system forces you to burn rerolls instead of allowing you full compensation of duplicate drops
2025-04-21 14:50:18,Lifeweaver rework idea,# Abilities 1 Healing BlossomLEFT CLICK charging time decreased to 09 from 145 seconds Max heal decreased to 50 from 80 Heal per secondsHPS increased to 555 from 552 After getting healed by this ability ally can heal themselves for 100 in 18 seconds by dealing damage to enemy100 damage max You can still heal ally selfhealing but max heal ally gets by this ability cant be higher than 50 per 09 seconds 2 Thorn VolleyRIGHT CLICK 10 cooldown reduction of abilities per 100 damage dealt by this ability against enemy heroes 3 Petal PlatformLSHIFT 40 heal per seconds 15 rate of fire buff on platform Size and health of platform increases by 25 following number of allies on it100 max Enemies get rooted for 1 second while rising up after stepping on platform 4 Rejuvenating DashSPACE cooldown increased to 7 seconds from 5 seconds Max range increased to 10m from 69m 50 damage reduction during dash 5 Life GripE deals 100 damage to all enemies in the pathbetween Lifeweaver and ally Ally can cancel the pull with interaction key while being pulled 6 Tree of LifeQ stem part of tree gets 2 times fatter but still usable in narrow spaces Tree knocks enemies away from you once for 8m when the tree grows with 50 instant damage # Perks Superbloomminor number of thorns you must hit reduced to 10 from 20 damage reduced to 25 from 40 Swamp Treeminor tree slows down enemy by 40 Petal Pathmajor you can chargeuse two petal platforms at the same time Center of Pondmajor 20 more heal per seconds and 10 more rate of fire buff on and under platform # Ideas My main idea was 3 points Make his heal more stable make him more active and leading give certain reasons to use each of his abilities Now you can heal stably as charging time of his basic heal hugely reduced ally can self heal for a while and petal platform heals allies too You can also play him more actively and lead the game as you have more time to use other abilities except healing and you have two more damagegrip and tree and crowd controlpetal and tree abilities now Each abilities have a certain reason to use as well his basic attack now lowers his cooldown of abilities platform heals you increases your fire rate and it roots enemies as well dash allows you dive into the enemy more boldly grip deals AoE damage in the path and tree deals damage and pushes enemies away I hope he will be played in dive rush comps or to counter them In more details of each abilities If allies and enemies are both on Petal Platform they all go up but only enemies are rooted I thought you must be able to cancel the Life Grip while you are being pulled as it has too much potential to be used in wrong ways Unlike walls like tree ice wall jagged wall its the only ability to directly change teammates position I thought Tree of Life doesnt have its own strength at all at the moment Heal is much lower than trans much less value as an obstacle as the stem part is 3 times smaller than ice wall So I added its own strength to push enemies away once with a bit of damage I thought it fits him as hes like an antidive support at the moment Also I thought its too bad as an obstacle so I made the stem part bigger Please tell me if you have any suggestions
2025-04-21 12:52:32,Original Hero Story Eryth Chapter 9 The Answer in Motion,# Read Previous Chapters Here Chapter 1 Born of a War Chapter 2 The Hunger That Survives Chapter 3 The Blade That Remembers Chapter 4 The Freedom Before Death Chapter 5 What They Say Chapter 6 The Dream Spoken Aloud Chapter 7 The War That Must Be Chapter 8 The Question Without an Answer # Chapter 9 The Answer in Motion Zenyatta rose from the ground weightless shifting into his stance His hands moved like the current of a river flowing never rigid Eryth drew the scavengers knife She did not hesitate She did not wait She struck first The blade cut through the air fast sharp direct But Zenyatta was not there He did not parry He did not block He simply moved and the blade slid past him striking only empty space She fights because he has made the choice to fight her That was the first thing he understood Eryth pivoted attacking again a sharp upward slash But again he turned with it redirecting her force without ever touching her Not stopping her Not resisting her Letting her pass Her third strike did not come immediately She stood still the knife steady in her hand watching him Zenyatta had not struck back once She let the knife fall from her fingers And she drew the mercenarys whipblade A ribbon of metal coiling striking extending She snapped it forward The whipblade cracked through the air an extension of control of command A weapon meant to force an enemy into submission Zenyatta did not submit He let it pass him like wind slipping between temple bells She attacked again the blade shifting from whip to rigid steel in a single instant a perfect execution of the mercenarys most practiced killing blow But it did not land Zenyatta had already stepped aside as if he had known it was coming before she did He could see the movements of others from her For a moment he thought that was all it was She was simply a machine carrying echoes of the past The whip lashed again high low and high forcing him into tighter movements But something felt different She was not hesitating She was not adjusting She was watching him She let the whip fall from her hand And then she raised the soldiers rifle A weapon of precision of calculation A tool of war designed to erase hesitation She did not hesitate She fired The first shot Zenyatta shifted just enough for the bullet to miss his shoulder The second he was already gone flowing out of its path like water slipping through fingers But then she fired not where he was but where he would be His gaze flickered toward her just slightly too late A bullet grazed his shoulder She had watched She had learned But not copied Zenyatta closed the distance She let the rifle fall from her hands And this time she fought without a weapon Zenyatta struck first Not with violence But with his whole body A single calculated strike aimed for the center of her chest Eryth turned with it She absorbed the impact redirected the force the same way he had And in that moment she was faster Her hand struck palm against metal an echo of his own motion Zenyattas balance shifted His body faltered She is not copying She is not just remembering She is understanding She was not a machine playing back data She was not a warrior stealing the style of another She carried it because they had chosen to fight her She fought because she had chosen too And in that moment Zenyatta made his own choice His breath slowed His stance softened Then he lowered his hands The battle was decided Eryth stopped Not because she didnt know what to do But because there was nothing left to fight She stood over him Staring Then slowly deliberately she bowed Zenyatta watched her unblinking And then he bowed in return Not because she won Not because she lost But because in the end they both made a choice Then without another word she turned and walked away And before she left she did what she had always done She took nothing from him No relic No possession But the way he moved that remained Later when she was alone she moved again The stance The breath she did not need The way his hands had turned not to strike but to guide She did not believe in balance She did not seek peace And yet the choice remained # Read Next Chapter Here Chapter 10 The Shape of a Choice
2025-04-21 07:33:13,Its save to say that Season 17 theme would be related to South Koreans mythologyculture,Based on upcoming Dva mythic which is inspired inspired by the Siberian tiger South Koreas national animal source Overwatch 2 Spotlight A New Era of Innovation and Excitement Mythic skins are always related to seasons theme so its its save to say that Season 17 theme would be related to South Koreans mythologyculture
2025-04-21 07:22:29,Why winning against a higher rank team is expected,Our team is gold 2 and the enemy team is platinum 5 During the fight we are doing slightly better than the enemy team and we won However it is shown as expected Why is a gold 2 team winning a platinum 5 team expected Either Overwatch has been placing the team rank icons wrong for ages or the rank is just meaningless
2025-04-21 04:00:46,Cosnole Deranked myself to bronze because Overwatch has stopped banning Ximming cheaters,I got console Overwatch when Overwatch 2 came out Since season 10 ive been around master 2 gm 4 since Recently overwatch has stopped banning players using Xim I used to get multiple messages a week about the cheaters i reported being banned Now not 1 message in MONTHS People are using their main account to cheat and not even being banned anymore Almost every game is a 3 or more stack with double hitscan xim with a egirl mercy pocket Overwatch is no longer my main game im simply not into playing double xim hitscan mercy egirl watch anymore I want my galactic skins for my mains and with the change to competitive point gain and completive rewards its simply not worth it Now i curb stomp bronze players on Tank and am getting skins quick After i get my skins im off to quick play for good I know ill get hate for throwing SO many games but i really dont care Just want to put this out there Maybe when Overwatch decides to ban the most obvious cheaters in existence and not someone for 2 months for saying 1 curse word in game chat more players will play ranked on console
2025-04-21 02:20:29,High pinglatency issue,For context I have stable FIberoptic internet with 600 downloadupload and have no issues until recently I was playing Overwatch 2 with my girlfriend as we do often and noticed after we played a few games my ping was 250 We live in the SAME house She had 40ms no problems So what do I do Check my speed make sure Im not downloading anything via task manager and nothing No downloads on her end my end just my 250 ping for absolutely no reason yes we both use ethernet and I play through Steam if that matters I cant figure out a fix other than to stop playing and come back later Anyone else having this issue
2025-04-21 01:29:49,Decided to try the game again Havent played since Ramattra release What do I need to know,Basically the title I played overwatch an unhealthy amount back when it released until about 2019 when I quit came back for the OW2 release and quit again when Ramattra released Ive played 3 games before making this post and I am completely lost on what the new heroes do what the fancy names are the perks and basically everything inbetween Please help
2025-04-21 01:20:35,Overwatch 2 Performance,Hello quick post hoping for quick answer Does anyone here have PC with RTX 5080 or RTX 5090 AND a 4K monitor Could you tell me how many FPS are you getting on full Ultra settings I am planning on buying either of these cards 4K monitor but I dont know if I should get 165HZ or 240HZ monitor Will 5080 be enough for 4K 240 fps on full utra settings Or should I get the 5090 I will be playing other games too obviously But Overwatch is just my main game for now Thanks BTW I was looking for some benchmarks where they tested overwatch on new graphic cards but couldnt find anything thats why Im asking here
2025-04-20 20:04:50,Changes Id love to see in overwatch,Long time a lurker here Sometimes when I play overwatch I think of some changes I love to see made in the game Some have a simple quality of life and some are ridiculous Id love to know your thoughts 1 When heroes die their abilities stop Great nerfs for Brigs Inspire Moiras Orbs 2 When the hero dies their deployable break Once my dead life weaver got me killed because a widow used his pad to snipe me on Gibraltar Great nerfs for Junkrat Torb Ilari Winston Ram Sigma 3 Grant a hero 100 temporary overhealth that depletes over time when picking up the flag on capture the flag I but someone getting the flag and instantly dying is a vibe killer 4 Add perks to some of the arcade modes Capture the Flag feels so outdated now 5 Allow Mei to ping in enemies in her ice block 6 Bring back LFG I know people said they never used it but that we before we had crossplay Encouraging users of a team to leave a platform to build a team will never make sense to me 7 Bring back temporary armour It felt like a really fun concept that I think can be balanced around Also I felt like it added texture to the game 8 Add lines on the floor for Clash I know they added a marker but trying to get your team to all rotate the same way after an objective has been captured is beyond frustrating 9 Update the endorsement system Make the perimeters of achieving each level public Also have reports avoid impacting someones endorsement level 10 If someone leaves your team in competitive add a modifier to the rank lost Even if its just minor I feel like some acknowledgement of having lost a losing battle would feel so much better
2025-04-20 19:45:11,Sombra Moira,I deal with both generally well as damage or support class but theres games where your team are negative kd and will not group up acknowledge danger pings or communication like group up vs the sombraMoira and just continuously die on a conveyor belt while playing like its a singleplayer campaign These 2 characters are the most picked among QP purely because this mode lacks coordination and they thrive on this If either of them are backline and at least 2 teammates arent marshalling together then its pretty much game over They mop the floor with casual fps players Its also shown when players start the game as traditional gun heroes like soldier soj Cassidy and then switch to sombra or Moira out of bitterness and begin actually putting up stat numbers this happens A LOT Players that cant commit to aiming will crutch these 2 broken characters Sombra virus 8 second hack 10 second translocator should only be usable when damage hasnt been received for 12 seconds because its ridiculous seeing her players retreating from most fights instantly at the first sign of combat only to have her cooldowns back in no time to begin harassing again This character type should be specialist precision requiring good judgment and planning but currently her entire kit is just pick up have immediate impact Its lazy and a waste of what could be an interesting hero Moira fade 9 seconds this is my main gripe with her It gives her too much agency for bad positioning and punishment of enemy dpssupport players If she had longer fade time then it would make her offense require good judgment because currently she is far too often used for mobility for players that are scared to commit to fights much like the aforementioned Sombra I understand that shes a offensive support but the fact that most players who play her confidently chase and harass most dpssupportat least in QP is a sign that she needs reworking from a development standpoint I used her for quite some time 2 years ago and absolutely destroyed teams yet felt next to no joy from doing this She just feels broken If they took her heal orb away and made her dps she would make much more sense than her current state in support Overall I think Overwatch 2 needs longer ability replenishment times for most characters something that would slow the pace down and make battles more memorable skillbased Currently most fights are a blender of ability spam and who 2v1s more often Abilities should feel powerful in the sense that they are potential gamechangers at the expense of messing up
2025-04-20 19:06:46,New Hero for Overwatch 2,Hello hello everyone Im an big fan of Overwatch since 201617 I once imagined an new Brazilian hero inspiring and using some references of icons of real life like Ayrton Senna and the love of Brazil people for Formula 1 for create an new hero for OW2 hope Blizzard can see it probably and impossibly not I know but hope you guys like and can opinion it here in comments some changes or additional stuff here Hope you like it 3 Name Turbotron Nationality Created in Rio de Janeiro Brazil but born in So Paulo Age 27 Voice Actor unknown Role DPS Health 200 Weapon Electric machine gun which generates blue energy shots that cause 50 damage at medium range in addition to having 50 ammunition and having to wait 5 seconds to reload Energy Ring Located on Turbotrons back it allows him to chase his enemies like a boomerang causing 70 damage at close range 50 at medium range and 30 at long range Amplifying Acceleration Turbotron launches a fast counterattack that allows him to become faster and his attacks and abilities are amplified for five seconds consequently increasing the damage caused by 25 Ultimate Brilliant Explosion When it reaches 100 Turbotrons ultimate ability allows the hero to overload his technological suit causing everything around him to explode and cause heavy damage to nearby enemies at medium range simply being in the middle of players on the enemy team increases its effectiveness Difficulty 2 stars Lore Born into a humble and wise family Pedro Alcntara de Silva was born during the reconstruction of the world after the Omnic Crisis His father Carlos Perez da Silva served in the Brazilian Army and later joined Overwatch His mother worked as a designer at Vishkar always creative and wanting to make the world a better place for everyone Despite everything Pedro always wanted to become a driver in the worlds famous singleseater category Formula Lux So he always trained and built karts with his mothers technology Although his father was against it because he wanted his son to be a soldier like him his mother supported it out of fear of the dangers of facing omnics and people with dangerous intentions While still a child the family moved from So Paulo to Rio de Janeiro where Pedro met his great childhood friend Lcio Correia dos Santos However his childhood was already troubled as Pedro had his first major trauma which was the repeated death of his father at the hands of the explosion of the Overwatch base in Switzerland This shook the family but it didnt prevented Pedro from achieving his dreams Now an adult Pedro progressed through the lower categories until he reached the elite of Formula Lux where he attracted a lot of attention being part of the strongest team on the grid winning four world titles in his first four years being a rising celebrity but one big event shaped his life In a race precisely in Switzerland a sniper named Widowmaker was assigned by Talon to assassinate Pedro in order to create chaos but luckily the lethal shot did not hit Pedros head but the car was still hit and so a terrible accident occurred almost taking his life then a wellknown doctor named ngela Ziegler helped Pedro saving his life installing supports to his severely damaged body but surviving so Pedro upon hearing the news and reading articles discovered Talons involvement in the attack after the accident Pedros mind changed ceasing to be arrogant and thinking about bed becoming a force for good and someone more humble and kind helping innocent people and bringing good to humanity by doing things really right So he temporarily retires from racing and becomes a vigilante acting in the shadows of the population and dedicated to serving the world as his father once did
2025-04-20 12:04:21,does anyone know how to fix this visual bug in overwatch 2,if anyone knows please let me know dm for kore info
2025-04-20 11:42:09,How do you change the button assigned for a certain perk,Baptiste has his first Minor perk Field Medicine by default assigned to Left ALT Mouse 1 and his second Minor perk Automated Healing is by default assigned to Left ALT Mouse 2 I want to assign a button to pick the Minor perk Automated Healing and ONLY that perk So for example if I pick the number 3 on my keyboard to be the button that picks his second Minor perk Automated Healing while I am in a game I would just press the number 3 on my keyboard when my perk is ready and Automated Healing will be chosen instantly How do I do this
2025-04-20 08:57:52,Overwatch Competitive Surveyplease read,Hello avid competitive players I am a student at UIUC in Stat 107 and for a project I have to get a dataset about something we are interested about If you could fill out this extremely short survey I would highly appreciate it I am not asking any personal identifying questions just questions about Overwatch such as peak ranks in both OW1 and 2 along with what platform and an estimate of total playtime Here is the link and thank you for all of your help The more people that fill this out the better data I get Ive been sending them to official discords for overwatch with permission from mods and it hasnt been going so good so hopefully a lot of people see it on here If anyone has anyways I can make this seem more internet friendly please let me know in the comments Ive met a lot of people who are super skeptical about it but I truly only want what is on the form and want as many people to answer it Thank you for your participation
2025-04-20 04:59:28,Give me one reason why Sojourn should not be 225 HP,Let me list some good reasonsas to why she should have had it when they originally did the 225 HP nerf 1 Good mobility especially with her double slide perk 2 Smallish hitbox which means she can be harder to hit 3 High burst damage with railgun180 on headshot but 234 with Mercy 4 Incredibly busted Ult in the right hands tbh railgun is so damn easy to hit these days that its not really a requirement to have the best aim with it 5 Kiriko being able to 2 tap her is based The only people who think she is even closed to balanced are the people who delude themselves that theyre good at the game and are a Sojourn OTP at the moment
