created,title_clean,body_clean
2025-03-27 09:45:07,Overwatch Champions Series 2025 China Stage 1 Regular Season,## Overwatch Champions Series 2025 China Stage 1 Regular Season #### Streams Redditstream ####Schedule TimeTeam 1Team 2Match Page 0900 Esports30Team EqualPost Match 1035 Levi03Little SheepPost Match 1220 CCPost Match Teams will be SHOWN in post match thread titles If this is wrong ping an active moderator and they can click here to hide them This thread pulls match data from this liquipedia page If the thread is out of data you can help by updating that page If something is wrong or missing please ping uWatchful1 in the comments
2025-03-25 22:41:50,Hotfix Hero Balance Patch Notes March 25 2025,Hotfix Balance Update This is a hero balance hotfix Replay codes from the March 18 2025 patch are still available Hero Updates Balance changes apply to both 5v5 and 6v6 game modes # Mauga Cardiac Overdrive No longer provides allies with damage reduction Cage Fight Ultimate cost increased 8 Barrier health reduced from 1500 to 1200 HP Berserker Passive Overhealth conversion rate reduced from 50 to 40 # Roadhog Take a Breather Maximum healing increased from 400 to 450 Whole Hog Ultimate cost reduced 12 # Winston Primal Rage Ultimate cost increased 10 # Zarya Energy Degeneration rate increased from 2 to 25 per second # Damage # Cassidy Peacekeeper Primary fire falloff range increased from 20 to 25 meters Secondary fire damage increased from 45 to 50 # Echo Base health reduced from 225 to 150 Shield health increased from 0 to 75 # Soldier 76 Heavy Pulse Rifle Primary fire now uses the larger projectile size 007 meters # Sojourn Power Slide Cooldown increased from 7 to 8 seconds Maximum duration reduced from 12 to 1 second # Widowmaker Base health increased from 200 to 225 HP # Support # Ana Biotic Grenade Cooldown increased from 12 to 14 seconds for non6v6 games modes Cooldown increased from 10 to 12 seconds for 6v6 games modes Shrike SelfNano Boost duration reduced from 8 to 6 seconds # Juno Orbital Ray Ultimate cost increased 10
2025-03-25 19:05:09,All changes made in the 6v6 test Spoiler Its not just the December 17th 2024 patch with perks,EDIT 1 March 26th 2025 This post was made before the 25th of March 2025 hotfix patch this post is still useful if you want to see the original changes made to the current 6v6 test EDIT 2 April 5th 2025 I found some mistakes Ive made in my patch as well as some oversights so I updated the pastebin and the patch below to include all the changes I missed plus Ive managed to confirm other changes I couldnt before EDIT 3 April 9th 2025 Managed to finally confirm Tracers falloff range and its 1020 meters Additionally I checked for Widows projectile size on secondary fire and I am 90 sure it matches 5v5 live version EDIT 4 April 13th 2025 Hopefully this is my last update I found out the tank passive reduces ult charge generation by 20 down from 25 in the previous test Good evening Competitive Overwatch If you played the current form of the 6v6 test you probably noticed some differences between the version we played all the way back in December and the current test And no Im not just talking about perks rather the changes made to their base kits Intentional or not Blizzard have made changes to the heroes base kits especially tanks which mostly puts them in a unique balance spot between how they behaved in December and their current state in 5v5 midseason 15 So after a lot of testing myself with a friend I found most if not all of the changes made to this version of 6v6 It is also important to note that there are some changes I couldnt verify and they are written as such below I have made 2 versions of the list of changes one comparing it with the December 17th 2024 patch the other comparing it with the live version both written down as if they are blizzard patch notes The comparison between it and the live game will be written down in this post meanwhile the comparison between the original 6v6 patch will be written down in a pastebin Also none of the lists include perks due to the extra amount of time it would have taken me to test it as well as not feeling any different from my experiences And feel free to double check all of my findings andor point out any mistakes Ive made or even add to what I already have Lastly before reading all the changes I want to note that I am not a blizzard developer I have no idea if these changes were made intentionally or if they simply forgotten to change them in the first place maybe even both From what I know all of these changes could be patched out as a bug fix First 6v6 patch on December 17th 2024 if you need a refresher Patch comparison between the December 17th 2024 patch and this 6v6 test NOTE Most of the changes overall are reverts to some abilities to behave similarly toexactly like the 5v5 live version Now for the patch comparing with the 5v5 live version a good chunk of these changes are already known and are equivalent to the December patch but I am still writing them down for better understanding Tank Tank role passive Knockback and critical damage reduction removed No longer grants extra health Ultimate generation reduction reduced from 40 to 20 DVa Base health increased from 225 to 350 Base armor reduced from 325 to 300 Fusion Cannons Weapon spread increased from 3375 to 4 degrees couldnt verify this change Defense Matrix Maximum duration reduced from 3 to 2 seconds Boosters Cooldown increased from 35 to 4 seconds Micro Missiles Cooldown increased from 7 to 8 seconds Doomfist Health increased from 375 to 425 The Best Defense Overhealth gained per target reduced from 40 to 35 HP Maximum temporary health reduced from 200 to 150 health Seismic Slam Cooldown increased from 65 to 75 seconds Power Block Cooldown increased from 7 to 8 seconds Duration reduced from 25 to 2 seconds Hazard Jagged Wall Cooldown increased from 12 to 15 seconds Health increased from 400 to 500 Junker Queen Health increased from 375 to 425 Adrenaline Rush Wound damage selfhealing multiplier reduced from 225x to 15x Is no longer affected by the damage role passive technically also in live but important to mention nonetheless Commanding Shout Cooldown increased from 12 to 15 seconds Mauga Base armor reduced from 150 to 100 Base health increased from 425 to 450 550 HP total Overrun Cooldown increased from 5 to 7 seconds Cardiac Overdrive Allied lifesteal reduced from 50 to 30 was potentially removed on the March 25th 2025 patch also not affected by the DPS passive Cooldown increased from 12 to 14 seconds Orisa Base health increased from 150 to 250 Base armor reduced from 325 to 250 500 HP total Fortify No longer immune to critical damage Energy Javelin Cooldown increased from 6 to 8 seconds Ramattra Base health increased from 250 to 350 450 HP total Void Barrier Cooldown increased from 13 to 16 seconds Nemesis Form Bonus armor reduced from 300 to 200 Reinhardt Base health increased from 250 to 325 Base armor reduced from 300 to 225 Now has the Steadfast passive again 30 knockback resistance its apparently bugged though and doesnt work Charge Cooldown increased from 7 to 10 seconds Fire Strike Cooldown increased from 6 to 8 seconds still has 2 charges Roadhog Base health increased from 600 to 650 Chain Hook Cooldown increased from 6 to 8 seconds Sigma Base shields reduced from 275 to 250 450 HP total Winston Base health increased from 225 to 350 Base armor reduced from 250 to 200 Jump Pack Cooldown increased from 5 to 6 seconds Barrier Projector Cooldown increased from 12 to 13 seconds Primal Rage Maximum health gain reduced from 700 to 500 Wrecking Ball Base shield health removed Base health increased from 300 to 500 Base armor reduced from 175 to 150 Adaptive Shield Radius reduced from 13 to 8 meters Piledriver Cooldown increased from 8 to 10 seconds Zarya Base health increased from 175 to 225 450 HP total Particle Barrier No longer shares a cooldown with Projected Barrier Health reduced from 225 to 200 Duration reduced from 225 to 2 seconds Cooldown reduced from 11 to 10 seconds Projected Barrier Health reduced from 225 to 200 Duration reduced from 225 to 2 seconds Cooldown reduced from 9 to 8 seconds Damage Damage role passive No longer has reduced affect for tank heroes its still at 25 Echo Duplicate No longer has a max health for copied target Hanzo Storm Bow Time to fully charge each shot reduced from 08 to 072 seconds couldnt verify this change Support Ana Sleep Dart No longer has a reduced duration versus tank heroes Cooldown reduced from 14 to 12 seconds Zenyatta Snap Kick Knockback reduced by 20 Couldnt verify this change Orb of Discord No longer has a cooldown per target Time to fall off target when not in line of sight increased from 15 to 3 seconds
2025-03-25 10:17:54,Incorporating certain perks on base kit ideas and replacement ideas,Certain perks feel like they should be incorporated into the base kit particularly if they are quality of life changes or add new abilities In addition to adding the perks to the base kit I will also balance them accordingly and give suggestions for the replacement While I do want to share my ideas I also want to hear your thoughts on these ideas both positive and negative Reaper Dire Triggers is now base kit but has a 6 second cooldown instead of 4 seconds This perk fixes Reapers biggest weakness and makes his gameplan way more fun and less painfully linear so Im puzzled as for why this is a major perk instead of minor let alone not base kit It was also just weird that he lacked a secondary fire until now and once he finally gets one its locked for most of the match The increased cooldown is in line with other cooldownbased damaging secondary fires like Orisa Echo and Soldier The replacement is Swift Step which replaces the 115 second animation before teleporting with a 0205 second wind up time I feel like Shadow Step is only good for rollouts but is pretty bad for escaping or using in the middle of the fight Making the teleport startup nearinstant makes it useful for teleporting behind enemies in the middle of a fight or as a backup escape if Wraith Form is on cooldown The short windup time still exists to make it fair but the goal is for teleporting to take less than a second since currently Shadow Step feels clunky Bastion Bastion like Reaper and Venture was missing an ability before perks SelfRepair is now a base kit ability but only heals 30 health per second without the perk and the current 90 with the perk 3x increase With the maximum heal being 33 seconds he can only heal 99 before recharging at base while he can heal 297 with the perk Since he lost self repair initially because he used to be overpowered the goal is to make the base heal not even able to heal half of his health at base without recharging but return it to its full heal power with the perk Additionally without the perk Bastions move speed is reduced by 35 without the perk but can move at normal speed during self repair with the perk a callback to how at launch Bastion was immobile while healing The new name is the least importamt part but I guess Improved Repair works Lifeweaver Lifeweaving is pretty underwhelming so it is now a minor perk replacing Cleansing Grasp which now exists at base even with it Lifeweaver is still just kind of a worse Kiriko The new major perk is Back to Normal which allows allies who had been life gripped to teleport back to the location they were gripped from 12 seconds after being gripped using the interact key a hologram shows during these 12 seconds so that both your team and the enemy know where youll be heading Its a pretty common occurence for a life grip to screw players out of a kill so giving players a choice to teleport back to their previous location would alleviate that issue I could see a teleport being too strong as a minor perk hence why I shuffled Lifeweaving around Roadhog This ones simple Scrap Hook now exists at base removing the requirement to reload if you unloaded all of your ammo The new perk with the same name just reloads all ammo instead of just 2 Its a similar situation to Torbs Fully Loaded which reloads 6 with base Overload and 18 with the perk Pharah Being able to move during Barrage should be a thing at base not a park Full movement is a bit too good at base so Pharah instead can move with a 50 penalty during Barrage while the perk gives her full movement speed again However Drift Thrusters now does a second thing Hover Jets regenerate at 10 fuel per second when falling a quarter of the 40 while on the ground Regenerating fuel in midair was an old feature which seems to be a running theme with perks I only made her regeneration 10 per second while in the air so shes not airborne all the time she can just stay in the air for longer Soldier 76 Soldier can reload while sprinting at base Simple quality of life change that should probably not be locked behind a perk Agility Training maintains its 20 faster sprint but the reload during sprint is replaced by being able to use Helix Rockets during Sprint Since its on a 6 second cooldown it shouldnt be too spammy Cassidy Okay this one isnt really adding the perk at base just taking what I like about the Quick Draw perk while hopefully fixing peoples issues with how the perk works At base Fan the Hammer can be cancelled with Primary Fire the primary use I get from Quick Draw is bursting with secondary first then primary for a faster kill With the perk holding down Secondary Fire continues using Fan the Hammer until the button is let go I see a lot of people complain about needing to repeatedly tap the button which is why holding allows for the old Fan the Hammer just with crits and less recoil
2025-03-24 21:29:25,Frejas high SELFDamage makes little sense from both gameplay and lore perspectives,Frejas right click explosion deals a maximum of 45 damage out of her 225 total health her bola deals up to 50 For reference Pharahs rocket only deals up to 20 damage to herself while Zarya right click deals 2755 depending on charge All other heroes with explosive weapons as opposed to ability or ult Sigma weapononly Junkrat Symmetra and Venture deal no selfdamage From a gameplay perspective in close quarter combat her right click is already at a disadvantage compared to her left click without the selfdamage 1 Less consistent 2 Makes her a sitting duck during the windup 3 Left clicks main downside spread is less relevant at close range Even if you judged the initial distance well since right click explosion depends on opponent location and has a delay it cant always be avoided Imagine an Ashe or Widowmaker after they took the risk to use right click instead of the more consistent left click and landed a sick 180 with 40 hp left they died afterward to its selfdamage It would be underwhelming From a loreperspective we know Freja built her weaponry to be nonlethal In her cinematic her bolts stunned Maximiliens goons instead of killing them and her bola kept alive the people she initially brought with her Itd be hard to believe she did all this with weapons so dangerous she cant even prevent from damaging herself She ought to take a page from her colleague at Overwatch Sojourn who can safely pass through her own Disruptor Shot Appendix List of all heroes with explosive weapons and the selfdamage they take from them Some may argue Frejas secondary fire is an ability but having an ammo pool of 1 and the frequency at which you can fire it do make it a weapon HeroWeapon SelfDamage Percentage Sigma0 Zarya50 Freja50 Junkrat0 Pharah25 Symmetra0 Venture0
2025-03-22 15:26:37,Freja 11 relative sens and other tidbits,Changed number and added detail explained below Apologies Since Freja has a different zoom ratio than AsheAnaWidow she needs a different relative sens to get 11 After digging up some old arcane knowledge measuring and calculate the magic number for microflicks at 103FoV is 625 for 1691610 and 8204 for 219 If anyone is interested the horizontal distance scaling is pretty deliberately 625 then you can run the maths Calculator for different FoVscreen movement distance Thought I might also include some other mechanical tidbits here feel free to contribute Dash goes straight up with more height if you dont input a direction Primary fire has scaling spread first 2 shots is almost pinpoint and 34 shots reasonably accurate so always weave your shots Bola charge activates bullet time Bola final blow counts toward your passive Passive is buffered if ultimate is available giving you 25 immediately after using ult Free dash perk expire when updraft cd is 9 secs aka 3 seconds For some reason holding bullet time right after pressing updraft gives you a very slight amount of additional height IMPORTANT EDIT As someone pointed out this is for a specific type of aim at 103FoV I decided to make the equivalent of this old calculator to cover different scenarios and adding Freja The sens I showed previously now edited above is for FULL SCREEN FLICK which is not realistic so Ive edited it to the microflick type where horizontal distance is set to 0 The current numbers should be equivalent to the familiar 5146 3789 sens on AsheWidow
2025-03-21 20:47:57,Freja Abilities and Perks,Notably most of her perks are different from what was originally reported
2025-03-21 01:23:25,Perks Role Q 5v5 Open Q 6v6 and stadium and are the future of OW,I am somebody who whole heartedly loves playing 5v5 I enjoy tanking more in 5v5 and the fights feel like they flow better However this iteration of 6v6 might be the best one yet Theres a lot of minor issues with it but I would definitely play 6v6 open queue over 5v5 open queue With Stadium coming up I can see a world where 5v5 and 6v6 are able to coexist in this same format and have Stadium be the more casual for fun mode Even if the player base peters out for 6v6 or maybe its just too much work I feel like Overwatch has been in a really strong upward trend in terms of player reception and fun Realistically nothing changed from the last season besides perks but they did so much to make things fun without breaking much
2025-03-20 12:19:51,SOOP CUP 2025 Season 1,
2025-03-19 17:10:41,Ive missed being a Flex player,Throughout Overwatchs history I have felt the transitions to role queue and 5v5 were overall the right decision for the game but after playing this comp 6v6 open queue I really forgot how much fun flexing around roles was I think especially in todays Overwatch it is so much more interesting too with the character cast we have and perks The most notable comps I have enjoyed are triple support Illari healer perk Sombra and Doom as a damage heavy tank These strategies have really made 6v6 feel so much nicer to me
2025-03-19 16:24:12,Is 6v6 Open Queue 2 Tanks max the way,Let me start be prefacing its probably way to early to give an accurate opinion on the new 6v6 test as generally anything that mixes up the game a lot makes it feel more fun for a while However I feel like the 6v6 open queue with 2 Max tanks is such a simple yet effective solution to the issues Overwatch has had and so far it feels great You receive the faster queue time benefits of Open Queue while also bringing in some needed restriction with 2 tank limit Part of me wonders if they could even straight up combine 222 open queue to get the best of both worlds The biggest issue of course then would be how do people seamlessly swap roles as needed during a match If that isnt solvable though I think the 2 tank limit might be enough Sure there is a likelihood that 3 supports could become oppressive like in another game but I think that is an easier solution to fix than queue times or the pains 5v5 cause As a tank myself I enjoyed 5v5 for a while but the burden of solo tanking started to become a huge drag I know other roles dont particularly enjoy fighting the solo tank raid boss that 5v5 requires I hope the team seriously considers a full swap back to 6v6 at this point I know many are still skeptical of open queue even with the 2 tank limit but Im surprised how good it has felt so far
2025-03-18 19:13:54,Overwatch 2 Retail Patch Notes March 18 2025,
2025-03-17 19:03:42,One Random OWL Match Every Day Day Four,Our first match of Overwatch 2 presents itself today and its a good one The funniest thing about this match is the title of the YouTube video because it used an so when the Fusion became the Infernal the titles of many YT videos featuring them changed too Hangzhou Spark vs Philadelphia Fusion May 29th 2022
2025-03-17 14:15:06,Moving Barrage shouldnt be a perk,One of Pharahs minor perks needs to be reworked The ability to move during barrage is too good and Im pretty confident its the overwhelming choice among players certainly among pros There have been a lot of games where I hold barrage until I hit 23 more rockets just so it isnt an instant death button Minor perks are supposed to come up around your first ultimate anyways so it feels like its always better than the alternative The shields perk isnt even that bad it was a nice buffer using it in Junkenstiens Lab but its just not as useful as its alternative Moreover idk how you really tune either in any direction to try and balance them You could scrap the shields perk and just go for another more equal alternative but were I the devs Id just make moving barrage part of the kit since its so common now anyways and give her a different minor perk If everyone takes moving barrage and its almost always available by the first ult anyways I think it should just be a QoL change Not that Pharah needs buffs in my opinion What other perks are so ubiquitously good QoL and hard to balance that they should just be a part of the base kit Overload reloading rivet gun ammo comes to mind
2025-03-16 14:00:47,Overwatch Champions Series 2025 Asia Stage 1 Main Event Match 2 PostMatch Discussion,#Overwatch Champions Series 2025 Asia Stage 1 Main Event #### Team 1 Score Team 2 Crazy Raccoon#teamsc07r0424#teamsc04r04Team Falcons
2025-03-16 10:29:56,Overwatch Champions Series 2025 Asia Stage 1 Main Event Match 1 PostMatch Discussion,#Overwatch Champions Series 2025 Asia Stage 1 Main Event #### Team 1 Score Team 2 Team Falcons#teamsc04r0440#teamsc12r04ZETA DIVISION
2025-03-16 08:45:52,Overwatch Champions Series 2025 Asia Stage 1 Main Event,## Overwatch Champions Series 2025 Asia Stage 1 Main Event #### Streams Redditstream ####Schedule TimeTeam 1Team 2Match Page 0810 Falcons#teamsc04r0440#teamsc12r04ZETA DIVISIONPost Match 1035 Raccoon#teamsc07r0424#teamsc04r04Team FalconsPost Match Teams will be HIDDEN in post match thread titles If this is wrong ping an active moderator and they can click here to show them This thread pulls match data from this liquipedia page If the thread is out of data you can help by updating that page If something is wrong or missing please ping uWatchful1 in the comments
2025-03-15 22:14:54,Is Tracer not just a must pick on Push maps,Since the Percocet update I have yet to actually lose a Push map Be it ranked or scrims Even preOxycodone my win rate on push was absurd I genuinely think Tracer kind of just breaks this gamemode For one her ability to stall push hold or straight up yoink the robot is ridiculous You cant do this in any other game mode Lose a team fight but lose virtually no progress whatsoever You can flip the point in controlflash but the other team can afford to lose progress there Not on push Theres also the issue of spawns making trades vital in push If you lose the fight but kill 2 or 3 you give yourself a huge advantage for the next one This advantage gets even better the later into the round you are This is where her perks come into it cause flashback and blink pack make her not just invincible but always good for her ones Combined with the flanky nature of every single push map save for maybe colosseo youre just always going to find a trade
2025-03-15 12:52:44,Overwatch Champions Series 2025 Asia Stage 1 Main Event Match 2 PostMatch Discussion,#Overwatch Champions Series 2025 Asia Stage 1 Main Event #### Team 1 Score Team 2 ZETA DIVISION#teamsc12r0440WAY
2025-03-15 10:48:09,Overwatch Champions Series 2025 Asia Stage 1 Main Event Match 1 PostMatch Discussion,#Overwatch Champions Series 2025 Asia Stage 1 Main Event #### Team 1 Score Team 2 Crazy Raccoon#teamsc07r0440#teamsc04r04Team Falcons
2025-03-15 08:45:26,Overwatch Champions Series 2025 Asia Stage 1 Main Event,## Overwatch Champions Series 2025 Asia Stage 1 Main Event #### Streams Redditstream ####Schedule TimeTeam 1Team 2Match Page 0820 Raccoon#teamsc07r0440#teamsc04r04Team FalconsPost Match 1010 DIVISION#teamsc12r0440WAYPost Match Teams will be HIDDEN in post match thread titles If this is wrong ping an active moderator and they can click here to show them This thread pulls match data from this liquipedia page If the thread is out of data you can help by updating that page If something is wrong or missing please ping uWatchful1 in the comments
